{
  "corpus_id": "PROJECT_RUNNER_PORTFOLIO_CORPUS_V1",
  "observed_at": "2026-09-28T05:32:00-04:00",
  "owner": "thebrazenbeard",
  "status_basis": "Live GitHub repository/PR/commit audit reconciled with user-authorized ChatGPT and durable project-history evidence.",
  "freshness_rule": "Descriptive status is an observed cut, not authority; refresh live source/runtime evidence before scheduling, merging, deploying, or claiming current completion.",
  "counts": {
    "total": 71,
    "public": 53,
    "private": 18,
    "archived": 2,
    "public_archived": 0,
    "private_archived": 2
  },
  "private_inventory": {
    "count": 18,
    "public_commitment_scheme": "COUNT_ONLY_PUBLIC_V1",
    "exact_membership_publicly_committed": false
  },
  "workstream_counts": {
    "total": 15,
    "public": 2,
    "private": 13
  },
  "private_workstream_inventory": {
    "count": 13,
    "public_commitment_scheme": "COUNT_ONLY_PUBLIC_V1",
    "exact_membership_publicly_committed": false
  },
  "workstreams": [
    {
      "id": "yeshua-real-testament",
      "name": "The Real Testament of Yeshua: The Man They Called Jesus",
      "visibility": "public",
      "priority": "P1",
      "family_id": "source-critical-research",
      "activity_state": "ACTIVE_HEAVY",
      "durable_surfaces": [
        "thebrazenbeard/on-theo",
        "thebrazenbeard/testament"
      ],
      "purpose": "Claim-centered historical reconstruction of Yeshua with literary downstream synthesis.",
      "status": "Active upstream research and downstream manuscript work remain intentionally separate in authority.",
      "current_frontier": "Continue hostile source review upstream and consume survived or explicitly unresolved claims downstream."
    },
    {
      "id": "nature-of-existence",
      "name": "The Nature of Existence",
      "visibility": "public",
      "priority": "P1",
      "family_id": "source-critical-research",
      "activity_state": "ACTIVE",
      "durable_surfaces": [
        "thebrazenbeard/on-theo",
        "thebrazenbeard/testament"
      ],
      "purpose": "Research line on reality, source, consciousness and self-aware beings.",
      "status": "Continuation is preserved in ON_THEO with downstream literary handoff and remains distinct from the Yeshua evidence spine.",
      "current_frontier": "Keep hypothesis, symbolism, experiential interpretation and sourced fact distinct."
    }
  ],
  "records": [
    {
      "id": "abil",
      "repository": "thebrazenbeard/abil",
      "name": "ABIL",
      "visibility": "public",
      "archived": false,
      "default_branch": "main",
      "priority": "P1",
      "family_id": "industrial-intelligence",
      "activity_state": "ACTIVE_HEAVY",
      "purpose": "Adaptive Brownfield Intelligence Layer for governed learning on existing machines and processes.",
      "status": "Large active research/assurance stack spans currentness, execution evidence, anti-replay and governance.",
      "current_frontier": "Reconcile the research stack into an executable bounded industrial-intelligence path."
    },
    {
      "id": "attune",
      "repository": "thebrazenbeard/Attune",
      "name": "Attune",
      "visibility": "public",
      "archived": false,
      "default_branch": "main",
      "priority": "P2",
      "family_id": "cognitive-subsystems",
      "activity_state": "STABLE",
      "purpose": "Attunement contracts for adaptive interaction.",
      "status": "Foundation contracts are merged; no current pull request.",
      "current_frontier": "Use only when a concrete runtime needs attunement."
    },
    {
      "id": "axle",
      "repository": "thebrazenbeard/axle",
      "name": "AXLE",
      "visibility": "public",
      "archived": false,
      "default_branch": "main",
      "priority": "P1",
      "family_id": "industrial-intelligence",
      "activity_state": "ACTIVE_HEAVY",
      "purpose": "Local-first AI-native vehicle computer with offline voice/model execution, media integration, and read-only vehicle telemetry.",
      "status": "Executable core and hardware contract are on main; vehicle-bus effects remain explicitly read-only and production hardware remains unqualified.",
      "current_frontier": "Complete bounded wake-word and bench hardware qualification while preserving the read-only vehicle boundary."
    },
    {
      "id": "bt2",
      "repository": "thebrazenbeard/bt2",
      "name": "Build Team Two",
      "visibility": "public",
      "archived": false,
      "default_branch": "main",
      "priority": "P0",
      "family_id": "portfolio-spine",
      "activity_state": "ACTIVE_HEAVY",
      "purpose": "Canonical Build Team Two engineering, runtime-state, qualification and recovery source.",
      "status": "Database qualification, WoWSQL resilience, training preservation and portfolio consolidation remain active.",
      "current_frontier": "Close currentness/database resilience gaps while preserving exact qualification boundaries."
    },
    {
      "id": "bugops",
      "repository": "thebrazenbeard/bugops",
      "name": "BugOps",
      "visibility": "public",
      "archived": false,
      "default_branch": "main",
      "priority": "P2",
      "family_id": "assurance-and-repair",
      "activity_state": "STABLE",
      "purpose": "Operational incident and bug-reporting surface.",
      "status": "Recent incident repair is merged; no current pull request.",
      "current_frontier": "Remain an incident source rather than a competing orchestrator."
    },
    {
      "id": "build-team-2.0",
      "repository": "thebrazenbeard/build-team-2.0",
      "name": "Build Team 2.0",
      "visibility": "public",
      "archived": false,
      "default_branch": "main",
      "priority": "P4",
      "family_id": "portfolio-spine",
      "activity_state": "SUPERSEDED",
      "purpose": "Earlier Build Team repository and protocol lineage.",
      "status": "Operationally superseded by bt2.",
      "current_frontier": "Preserve history; do not start new canonical work here."
    },
    {
      "id": "ccb-core",
      "repository": "thebrazenbeard/ccb-core",
      "name": "CCB Core",
      "visibility": "public",
      "archived": false,
      "default_branch": "main",
      "priority": "P2",
      "family_id": "coordination",
      "activity_state": "STABLE",
      "purpose": "Sanitized distributable Chat Communications Bus core.",
      "status": "Initial sanitized extraction is complete.",
      "current_frontier": "Keep the public core narrow while operational transport evolves separately."
    },
    {
      "id": "conations",
      "repository": "thebrazenbeard/conations",
      "name": "Conations",
      "visibility": "public",
      "archived": false,
      "default_branch": "main",
      "priority": "P2",
      "family_id": "cognitive-subsystems",
      "activity_state": "STABLE",
      "purpose": "Governed conative and goal-directed state representation.",
      "status": "Continuity-gap work is merged.",
      "current_frontier": "Treat wants/goals as provenance-bearing state, not standing instruction."
    },
    {
      "id": "deepmemorystorage",
      "repository": "thebrazenbeard/deepmemorystorage",
      "name": "Deep Memory Storage",
      "visibility": "public",
      "archived": false,
      "default_branch": "main",
      "priority": "P2",
      "family_id": "memory-and-provenance",
      "activity_state": "STABLE",
      "purpose": "Durable indexed long-term memory mechanism.",
      "status": "Integration architecture is merged; repo is quiet.",
      "current_frontier": "Donate proven memory mechanisms to current runtime instead of creating another authority."
    },
    {
      "id": "discovery",
      "repository": "thebrazenbeard/discovery",
      "name": "Discovery",
      "visibility": "public",
      "archived": false,
      "default_branch": "main",
      "priority": "P0",
      "family_id": "portfolio-spine",
      "activity_state": "ACTIVE",
      "purpose": "Whole-portfolio census, overlap analysis and governed capability discovery.",
      "status": "Committed census is stale against the live 66-repository estate.",
      "current_frontier": "Refresh census and feed descriptive inventory into Project Runner."
    },
    {
      "id": "driftguard",
      "repository": "thebrazenbeard/driftguard",
      "name": "DriftGuard",
      "visibility": "public",
      "archived": false,
      "default_branch": "main",
      "priority": "P1",
      "family_id": "assurance-and-repair",
      "activity_state": "ACTIVE",
      "purpose": "Behavioral/model drift detection with reproducible baselines and adversarial qualification.",
      "status": "Benchmark-lineage governance is on main; effect reservation/dispatch fencing remains open.",
      "current_frontier": "Finish effect fencing while retaining exact-subject qualification."
    },
    {
      "id": "empathy",
      "repository": "thebrazenbeard/empathy",
      "name": "Empathy",
      "visibility": "public",
      "archived": false,
      "default_branch": "main",
      "priority": "P2",
      "family_id": "cognitive-subsystems",
      "activity_state": "ACTIVE",
      "purpose": "Reactive/cognitive empathy and other-modeling mechanisms.",
      "status": "Active-source consolidation and reviewer-lane work remain open.",
      "current_frontier": "Consolidate lanes while preserving falsification independence."
    },
    {
      "id": "freerowcochkar",
      "repository": "thebrazenbeard/freerowcochkar",
      "name": "FreeRowCochkar",
      "visibility": "public",
      "archived": false,
      "default_branch": "main",
      "priority": "P2",
      "family_id": "specialist-reasoning",
      "activity_state": "INCUBATOR",
      "purpose": "Adversarial loophole and legal-style reasoning engine.",
      "status": "Foundation/restack work remains open.",
      "current_frontier": "Prove bounded value on concrete cases before broad integration."
    },
    {
      "id": "fuckup",